standard_text,dialect_text,dialect
ভালো ব্যবহার করেন না,ইতার কতা বার্তা ঠিক নাই ,Chittagong
একসাথে বসে খায় ও না,এখত্রে বয়ইনে নো খাই,Chittagong
আম্মু এসব দেখে খুব কষ্ট পাচ্ছেন যেহেতু আমার বাবা নেই,"আম্মা এইন দেখিনে বওত কষ্ট ফার,তার উদ্দি আর আব্বা ও নাই ",Chittagong
আমার স্বামী এসব নিয়ে কিছু বলতে গেলে উনি মনে করেন বউ ছেলের হয়ে গেছে,আর যামাই ইন লইয়েরে কিছু হইতে গেলে মনে গরেদে বউ ফোয়ার অই গিয়োই,Chittagong
উনার আরো একটা ছেলে আছে,ইবার উগ্গো ফোয়া আছে,Chittagong
সে চাকরি করে বিয়ে বিয়ে করে নাই,"ইতে চওরি গরে, বিয়ে বিয়ে নো গরে",Chittagong
মার কাছে ছোটো ছেলেই সব,"মা ওর কাছত, ছোড পোয়া বেক",Chittagong
তার ছোটো ছেলের কোন দোষ নেই,ইতার ছোড পোয়ার কোনো দোষ নাই ,Chittagong
আমি নিজে দেখেছি সে কেমন বাজে ব্যবহার করে মায়ের সাথে,"আই নিজোর চোখত দেইখ্খি ,ইতি ইতার আম্মার লাই খারাপ কতা হয়",Chittagong
সংসার এর সব খরচ আমার জামাই দেয়,গরর বেক ট্যায়া  আর জামাই দে যে,Chittagong
সব কাজ আমি করি উনি একটা কাজ ও করেন না তাও আমরা খারাপ,"বেক খাম আই গরি,ইবে উগ্গোও খাম নো গরে , তওও আরা হারাপ",Chittagong
আমার চাচা শ্বশুর সবাই আলহামদুলিল্লাহ নিজেদের বাড়ি গাড়ি করে ফেলেছেন,আর চাচা ওওর বেক্কুনে আলহামদুলিল্লাহ নিজেগোর বাড়ি গাড়ি গরি ফেলাইই,Chittagong
উনি নামাজ কালাম ও ঠিক মত পড়েন না,ইতি নামাজ কালাম ও নো পড়ে,Chittagong
আমি এখন এইগুলো মেনে নিতে পারছি না,আই এহন ইউন মানিত নো পারির,Chittagong
আমি চাচ্ছি আলাদা বাসায় চলে যাবো আমরা,"আই চিন্তা গরির দি, আই আলাদা বাসাত চলি যাইয়ুম",Chittagong
এইটা কি ঠিক সিদ্ধান্ত হবে আমাদের জন্য?,ইবা কি টিক সিদ্ধান্ত ওইবো নে আরোর লায়?,Chittagong
আমার বিয়ে হয়েছে চার বছর,আর বিয়া অইয়ে চাইর বছর।,Chittagong
আমার মা মারা গেছে আট মাস আগে,আর মা ইন্তেকাল গইজ্জে আট মাস আগে,Chittagong
আমি আমার বাবা মার একমাত্র সন্তান,আই আর বাফোর একমাত্র সন্তান,Chittagong
মা মরে যাওয়ার পর বাবা খুব একা হয়ে গিয়েছে,মার ইন্তেকালোর ফোর খুব এহলা অইগিয়ে,Chittagong
তাকে দেখার মত তেমন কেউ নেই,তারে দেহার লাই  এইল্লে হনিক্কে নাই।,Chittagong
আমি আমার সাধ্য অনুযায়ী চেষ্টা করি বাবার খোঁজ খবর নিতে,আই আর সাধ্য মত চেষ্টা গরি বাফোর হোয হোবর লইবেল্লাই,Chittagong
আমার শ্বশুরবাড়ির লোকজন এটা একেবারেই পছন্দ করে না,আর অররবাডির মানুষ তারা আরে এক্কেরে ফোছন্দ নো গরে,Chittagong
বাবার খোঁজখবর রাখার চেষ্টা করি সব সময়,বাফোর হজহবর রাহিবার চেষ্টা গরি সব সমত,Chittagong
আমার স্বামী এবং তার বাড়ির লোকজন কোনভাবেই রাজি না,আর জামাই আর তারার বাড়ির মানুষ তারা হোনভাবেই রাজি নো,Chittagong
একটা মেয়ের বিয়ে যাওয়ার পর তার পরিবারের প্রতি তার কি কোন দায়িত্ব থাকতে পারে না?,এক্কান মাইয়াফোয়া বিয়েরফোর তার ফরিবারর প্রতিতার কি হোন দায়িত্ব তাকিন্ন ফারে?,Chittagong
একটা ছেলে যেমন তার বাবা-মার দায়িত্ব পালন করে,এক্কান মরত ফোয়া তার মা বাফোর দায়িত্ব ফালন গরে ,Chittagong
একটা মেয়েও যদি তার বাবার দায়িত্ব পালন করে সেই ক্ষেত্রে সমস্যাটা কোথায় আমি জানিনা,এক্কান মাইয়াফোয়াও যদি তার বাফোর দায়িত্ব ফালন গরে ইয়েনত সমইস্যা হডে আই নো যানি,Chittagong
ঈদ গেছে দুইদিন পার হয়ে গেল,ঈদ অইয়েদে দুইদিন ফার অই গিয়য়ি,Chittagong
আমি আমার বাবার বাসায় যাওয়ার অনুমতি পাচ্ছি না,আই আর বাফোর বাড়ি যাইবার অনুমতি নো ফাইর,Chittagong
তাদের অনুমতির অপেক্ষা করতে হচ্ছে,তারার অনুমতির অফেক্কা গরন ফরের,Chittagong
আমরা সবাই ঢাকায় থাকি,আরা বেয়াক্কুন ঢাহাত তাকি,Chittagong
আমাদের পুরা বাড়ি জুড়ে বাবা একা দুই তিনজন কাজের লোক আছে সাথে,আরার ফুরা বাড়িত বাবা এহলা দুই তিনজন মাইনসের ফওয়ারিত আসে,Chittagong
বাবা খুব করে চাচ্ছিল যেন আমি বাসায় যাই,বাবা কুব গরি ছার আরা যেন বাসার যাই,Chittagong
আজ রাতে বাবা হঠাৎ করে অসুস্থ হয়ে পড়েছে খবর শুনে হাসপাতালে এলাম,আজিয়া লাতিয়া বাবা হতাৎ অসুস্থ অইগিয়ে ইয়ান ফুনিয়েরে হাসফাতালত আইসসি,Chittagong
রাতের বেলায় হাসপাতালে আসতে চাইলাম সেখানেও বাধা,লাতিয়া হাসফাতালত আইতে সাইলাম ইয়ানতও বাধা,Chittagong
সব বাধাকে পিছনে ফেলে আমি একাই হাসপাতালে এসেছি,সব বাধা ফিচ্চে ফেলি এহলা হাসফাতালত আই গিয়ি,Chittagong
আমার স্বামী আমার সাথে আসেনি,আর জামাই আর ফওয়ারিত আইন্নফারের,Chittagong
তাদের কথাবার্তা শুনে মনে হয়েছিল আমাকে বিয়ে করেছে মানে আমাকে কিনে নিয়েছে,ইতারার হতাবার্তা ফুনি মনত অর আরে বিয়া গইজ্জে মানে আরে কিনি ফেলাইয়ে,Chittagong
বাবাকে হাসপাতালে দেখে খুব খারাপ লাগছে,বাবারে হাসফাতালত সাইয়েরে খুব হারাফ লাইগগে,Chittagong
আমি মনে হচ্ছে ভুল মানুষের সাথে সংসার শুরু করেছি,আত্তুন ভুল মানুষের ফোওয়ারিত সংসার গইজ্জি,Chittagong
নিজের পছন্দ বিয়ে করাটা উচিত হয়নি,নিজের ফসন্দ মতন বিয়া গরন ঠিক নো অয়,Chittagong
আমি এখন থেকে সিদ্ধান্ত নিয়েছি আর কারো কথা আমি শুনবো না,আই এহনেত্তুন সিদ্ধান্ত লইয়ি আর হনিক্কের হতা নো ফুইন্নুম,Chittagong
যতদিন ইচ্ছা বাবার বাসায় থাকবো বাবার সেবা যত্ন করব,যতদিন মনত ছায় বাফোর বাড়িততাইক্কুম বাবার সেবা গইজ্জুম,Chittagong
এতে যদি আমার স্বামীর খুব বেশি সমস্যা হয়,ইয়েনত যদি আর জামাইর খুব বেসি সমইস্যা অয়,Chittagong
তাহলে তার সাথে আলাদা হয়ে যাব,তাইলে আলাদা অই যাইয়ুম,Chittagong
আমার সিদ্ধান্ত ভুল না সঠিক তা জানিনা,আর সিদ্ধান্ত গম না হারাফ তা নো জানি,Chittagong
আমার সম্পর্কের ৪ বছর হতে চলল,আর সম্পর্কর চার বছর অই যার,Chittagong
ছেলে আর কেউ না আমারই খালাতো ভাই ,ফোয়া আর হনিক্কা নয় আর হালতো ভাই,Chittagong
উনি দেশের বাহিরে থাকে খুব ঘন ঘন আসা যাওয়া করত,উনি বিদেশ তাহে বেস বেস আসা যাওয়া আসিল,Chittagong
তাই সম্পর্কটা বেশ ভালই ছিল,এতেল্লাই সম্পর্কগান ভালা আসিল,Chittagong
উনি দেশে আসলে আমাকে এয়ার্পোটে যাইতে হইত,উনি দেশেত আইলে আত্তুন এয়ারফোর্টত যন ফইত্তো,Chittagong
এরপর সে আরেকটা ফ্লাইটে করে বাসায় যাইত,এয়ারফোরত আরেক্কান ফ্লাইটেত গরি বাসাত যন ফইত্তো,Chittagong
আমার সাথে সে আগে দেখা করত,আগে আর ফোয়ারিত দেহা গইত্তো,Chittagong
উনি শুধুমাত্র আমার সাথে দেখা করার জন্য দেশে আসছে,উনি শুধুমাত্র আর ফোয়ারিত দেহা গরিবেল্লাই দেশত আইসসে,Chittagong
সে তাঁর বাসায়ও যায়নি,সে নিজের বাসাতও নো যায়,Chittagong
উনার কাজ বাদে যেইটুকু সময় থাকত আমার সাথে কথা বলতো ,উনার হামকাজর ফরে যদ্দুর সময় তাইতো আর ফোয়ারিত হতা হইত,Chittagong
আমি তাঁর সাথে সারারাত জেগে ফোনে কথা বলতাম,আই তার ফোয়ার গোডা লাইত যাগিয়েরে হতা হইতাম,Chittagong
ডিসেম্বর মাসে সে তার পরিবারকে জানায় আমার কথা,ডিসেম্বর মাসত আর হতা হইয়ে তার বাসাত,Chittagong
তার পরিবার কোনোমতেই এই বিয়েতে রাজি না,তার বাসাত্তুন আরে বিয়াল্লাই হোনভাবেই মানি নো লই,Chittagong
এরপর সে আমার সাথে যোগাযোগ রাখেনি,এয়ার ফরত আর ফোয়ারিত র যোগাযোগ নো রাহে,Chittagong
এইটাই আমার সাথে তার শেষ কথা,ইয়ানি তার ফোরাইত আর শেষ হতা,Chittagong
আমাকে ব্লক করে দেয় সবখান থেকেই,আরে ব্লক গরি দিয়ে বেগ যায়গাত্তুন,Chittagong
আমি নিজে অনেক অসুস্থ,আই বউত অসুস্থ,Chittagong
আমি বিগত ৬ মাস রাতে ঘুমাতে পারি না,গিয়েদে ৬ মাস আই গুম যাইন্নো ফারি,Chittagong
আমি বেশ কিছুদিন আগেই জানতে পারি আমার বড় বোন পরোকিয়ায় লিপ্ত,আই বেস কিছুদিন আগেত্তুন জানি আর ভোইন ডর ইবা ফরোকিয়া গরের,Chittagong
তার অফিসের বিবাহিত এক লোকের সাথে,তার অফিসর এক নিয়াইত্তে বেডার ফোয়ারিত,Chittagong
আমার বোন অবিবাহিত,আর ভোইন আ-বিয়াইত্তে,Chittagong
আমার বোনের কাজ কথা অনেক দিন ধরেই সন্দেহজনক মনে হওয়ায় আমি তাকে নজরে রাখছিলাম,আর ভোইনর হাম গাজ হতা বাত্রা সন্দেহজনক মনে অইয়ে আই এতাল্লাই তারে নজরত রাইক্কিলাম,Chittagong
আমি বিশ্বাস করতে পারছিলাম না আমার বোন এই কাজ করবে,আই বিশ্বাস গরিন্নোফারির আর ভোইন এই হাম্মান গরিবদে,Chittagong
সে নানান বাহানায় বাসায় একা থাকতে চাইতো,সে নানান বাহানা লইয়েরে বাসাত এহলা তাকিবেল্লাই চাইতো,Chittagong
বাসায় আমি ছাড়া কেও কিছু জানে না,বাসাত আই ছাড়া হনিক্কায় হনো কিছু নো যানে,Chittagong
আমার বাবা বেচে নেই,আর বাবা বাসি নাই,Chittagong
সমাজে সবাই আমাদের অনেক সম্মান দিয়ে চলে,সমাজত বেয়াক্কুন আরারে সম্মান দি চলে,Chittagong
আমার বোন কেন এই পথে পা বাড়ালো জানাজানি হলে কিভাবে মুখ দেখাবো সেই চিন্তায় ঘুমাতে পারছি না,আর ভোইন কিল্লাই এই ফোতত ফা বাড়াইয়ে জানাজানি অইলে কেনে মুখ দেহাইয়ুম সেই চিন্তায় গুম যাইন্নফারির,Chittagong
বাসায় কাকে জানাবো কিভাবে জানাবো বুঝতেছিনা,বাসাত হারে হইয়ুম কেনে হইয়ুম নো বুজির,Chittagong
আমি আমার বোনের চেয়ে অনেক বছরের ছোট,আই আর ভোইনত্তুন বউত বছরের ছোড,Chittagong
আমার বোনকে কিভাবে এই পথ থেকে সরিয়ে আনবো কিছুই বুঝতে পারছি না,আর ভোইনেরে কেনে এই ফতেত্তুন সরাই আইন্নুম হনক্কিসু নো বুজির,Chittagong
বাসায় ভয়ে বলতে পারছি না,বাসাত ডরে হইন্নুফারির,Chittagong
যদি আমি জেনে গেছি শুনে আমার ক্ষতি করার চেষ্টা করে,যদি আই জানি গিয়ে ইন ফুনিলে আর ক্ষতি গরিবেল্লাই চেষ্টা গরিব,Chittagong
ঐ লোক যদি আমার বোনের কোনো ক্ষতি করে,বেডা ইবা যদি আর ভোইনর হনো হতি গরে,Chittagong
কি করা উচিত এমন পরিস্থিতিতে,কি গরন উচিত এইল্লে ফরিস্থিতিত,Chittagong
আমার মনে হচ্ছে আমি জেনে গেছি শুনে ওরা আমাকে খুন করতেও দুইবার ভাববে না,আত্তুন মনত অরদে ইতারা জানি গেইলই আরে মারিফেলিবেল্লাই ইতারা দুইবার চিন্তা নো গরিবো,Chittagong
এতো এতো সংসারের ঝামেলা দেখে পোস্ট করা,এতো এতো সংসারর ঝামেলা সাইয়েরে পোস্টান গরন,Chittagong
সন্ধ্যায় আমার মা এসে আমাকে অভিযোগ দিলো আমার বাবার সাথে ঝগড়া হয়েছে আবার,সন্ধ্যায় আয়ার মা আইয়েরে আরে অভিযোগ গরের আর বাফোর ফোওয়ারিত ঝগরা অইয়ে।,Chittagong
আগে পরের হিসাব বাদ আজকে ঝগড়ার বিষয় আব্বু বিদেশে থাকে,আগের হতা বাদ আজিয়া ঝগরার বিষয় আব্বু বিদেশত তাজে,Chittagong
সে সারাদিন কত কষ্ট করে কাজ করে,"সে গোডা দিন হত হস্ট গরের,",Chittagong
এক বেলা খাওয়ার সময় পায় এসব আম্মু কে বলছে,এক বেলা হানাহাইবার সমত ফায় ইয়েন আম্মুরে হইয়ে,Chittagong
আম্মু তখন উলটে বলছে আমি ও সারাদিন অনেক কাজ করি,আম্মু তহন উল্ডা হইয়ে আইও গোডা দিন বহুত হাম গোরে,Chittagong
গত কাল না খেয়ে রোজা ছিলাম,গত হালিয়া না হাইয়েরে রোজা আসিলাম,Chittagong
এটা শুনে আব্বু রেগে ফোন কেটে দিছে,আব্বু ইয়ান ফুনিয়েরে রাগি ফোন হাডি দিয়ি,Chittagong
আমি আম্মু কে বললাম আব্বু শুনতে চাইছে একটু সান্ত্বনা ,আই আম্মুরে হইলাম আব্বু সান্ত্বনা ফুনিবেল্লাই সাইয়ে,Chittagong
আমিও বুঝি তুমি অনেক কষ্ট করো,আইও বুঝি তুই বহুত হস্ট গর,Chittagong
আম্মুর কথা কয়দিন আগে আমি তাকে একটা কষ্টের কথা বলছি,আম্মুর হতা হয়েকদিন আগোদি আই তারে এক্কান হস্টের হতা হইয়ি,Chittagong
সে আমার সাথে কি করলো আমাকে ও তাই করতে হবে,সে কি হাম গইজ্জে ইন আত্তুনও গরন ফরিবো,Chittagong
এমন মনোভাব নিয়ে সংসারে কখনো সুখ আসে না,এইল্লে মনভাব লইয়েরে হনোদিন সুখ নো আইবো,Chittagong
আমার মার কাছে আমার জামাই খুব ভাল,আর মার হাসে আর জামাই বেস গম,Chittagong
এক কথায় সোনার টুকরো স্বামী আমার,এক হতায় সোনার টুকরা জামাই আর,Chittagong
"আমাকে বোঝে, আমার সব কথা শোনে",আরে বুঝে আর বেয়াগ হতা মানে,Chittagong
আমার হয়ে প্রতিবাদ করে আরো কত গুন,আর অইয়েরে ফ্রতিবাদ গরে আরো হত গুন,Chittagong
আমি তাকে এইগুলো শিখাইছি,আই তারে ইন শিকাইয়ি,Chittagong
আমি রেগে থাকলেও সে বুঝতো না,আই রাগি তাকিলেও সে নো বুজিতো,Chittagong
আমি পাশে বসায়ে বলছি যে এই কাজের জন্য আমার খারাপ লাগছে,আই পাশে বাসাত হইয়ি এই হামোরলাই আর হারাপ লার,Chittagong
এখন তুমি আমার কাছে ক্ষমা চাও,এহন তুই আর হাসে মাফ সদ্দে,Chittagong
আমি তাকে কখনো তার কোনো কাজ নিয়ে খোটা দেই নি,আই তারে তার হামরলাই হডা নো দি!,Chittagong
আমি একটা কষ্টের কথা বললে সে নিজের কষ্টের কথা বলছে,আই এক্কান হষ্টের হতা হইলে সেও নিজের হষ্টের হতা হর,Chittagong
আমি আমার বিষয় সাইডে রেখে তাকে সান্ত্বনা দিছি,আই আর বিষয়কান সাইডে রাহিয়েরে তারে সান্তনা দোন ফোরের,Chittagong
সে যেভাবে আমাকে আশা করছে আমি নিজেকে সেভাবে উপস্থাপন করছি,সে জেইল্লে আত্তুন আসা গরে এইল্লে আই নিজেরে রাহি,Chittagong
আমার কখনো মনে হয় নি আমি কেন ছোট হবো,আর হনো সমত মনত নো অয় আই ছোট অইয়ুম!,Chittagong
ও আমার সাথে এটা করছে আমিও ওর সাথে এটা করবো,ও আর ফোয়ারিত ইয়ান গইজ্জে এতাল্লাই আইও ইয়ান গইজ্জুম,Chittagong
ও বোঝে না আমার ঠেকা নাই বুঝানোর,ইতে নো বুজে আত্তুনও ঠেকা আসে না আইও বুজাইতাম,Chittagong
মানুষ যার যার নিজের মত,মানুষ যার যার নিজের ডইল্লে,Chittagong
আমি বিশ্বাস করি কাউকে যদি আমি নিজের মত চাই তাহলে নিজের মত বানিয়ে নিতে হবে,আই বিশ্বাস গরি হনইক্কে যদি আরে নিজের ডইল্লে চায় তাইলে বানাইত্তারিবো,Chittagong
কাউকে নিজের মত বানানোর জন্য আগে আমাকে তার মত হতে হবে,হনইক্কেরে নিজের ডইল্লে বানাইবের আগদ্দি আরে তার ডইল্লে অন ফরিব,Chittagong
