standard_text,dialect_text,dialect
আমি ফুটবলে একটি গোল করেছি,আঁই ফুটবলত ওজ্ঞা গোল গইরগি,Chittagong
ফুটবল খেলা আমার জীবনের অংশ,ফুটবল কেলা আঁর যিবনঅর অংশ,Chittagong
আমি প্রতিদিন ফুটবল খেলতে যাই,আঁই ফত্তিন ফুটবল কেলা হাইতো যাই,Chittagong
বার্সেলোনা  ফুটবল ক্লাব খুব জনপ্রিয়,বার্সেলোনা ফুটবল ক্লাব কুব যনফ্রিয়,Chittagong
আমি ফুটবল ম্যাচ দেখতে খুব ভালোবাসি,আঁই ফুটবল মেচ দেইক্তো কুব বালবাসি,Chittagong
বাংলাদেশের জনপ্রিয় ফুটবলারগুলি অনেক উচ্চ মানের খেলোয়াড়,বাংলাদেশঅর যনফ্রিয় ফুটবলার ওক্কল বউত উচ্চমানর কেলোয়ার,Chittagong
ফুটবল খেলার সময় আমি আনন্দ পাই,ফুটবল কেলারসত আঁই আনন্দ ফাই,Chittagong
আমি ফুটবল ম্যাচগুলি দেখতে ভালোবাসি,আঁই ফুটবল মেচ্চিন দেইক্তো বালবাসি,Chittagong
আমি ফুটবল ম্যাচে উপস্থিত হতে চাই,আঁই ফুটবল মেচত উফস্তিত অইত চাই,Chittagong
ব্রাজিল ফুটবল দল বিশ্বসেরা,ব্রাজিল ফুটবল দল বিশ্ব সেরা,Chittagong
আমি ব্রাজিল ফুটবল দলকে সমর্থন করি,আঁই ব্রাজিল ফুটবল দলরে সমর্তন গরি,Chittagong
ব্রাজিল ফুটবল দল একটি শক্তিশালী দল,ব্রাজিল ফুটবলত একজ্ঞো শক্তিশালী দল ,Chittagong
ব্রাজিল ফুটবল দল বিশ্বকাপ চ্যাম্পিয়ন,ব্রাজিল ফুটবল দল বিশ্বকাফ চ্যাম্পিয়ন,Chittagong
আমি আর্জেন্টিনা ফুটবল দলকে সমর্থন করি,আঁই আর্জেন্টিনা ফুটবল দলরে সমর্তন গরি,Chittagong
আমি বাংলাদেশ ক্রিকেট দলকে সমর্থন করি,আঁই বাংলাদেশ ক্রিকেট দলরে সমর্তন গরি,Chittagong
বাংলাদেশ ক্রিকেট দল শক্তিশালী দলের মধ্যে একটি,বাংলাদেশ ক্রিকেট দল শক্তিশালি দল্লিনঅর মদ্ধে এক্কান,Chittagong
মেঘনা নদী বাংলাদেশের একটি প্রধান নদী,মেগনা বাংলাদেশঅর এক্কান ফ্রদান নদি,Chittagong
নীল নদী আফ্রিকার প্রধান নদীর একটি,নিল নদ আফ্রিকার ফ্রদান নদির এক্কান,Chittagong
নীল আকাশের নিচে তোমার হাত ধরে হেঁটে যেতে  চাই,নিল আসসান অর নিচে তোঁয়ার আত দরি আইটত চায়,Chittagong
তোমার সাথে নীল আকাশের নিচে বসে গল্প করতে চাই,তোঁয়ার ফোয়ারে নিল আসসান অর নিচে বই গল্ফ গইরতো চায়,Chittagong
আমাজন নদী দুনিয়ার সবচেয়ে বড় নদী হিসাবে পরিচিত,আমাযন নদি দুনিয়ার বেজ্ঞুনরতুন বরা ডর নদি,Chittagong
আকাশের নীল রঙটি অসাধারণ,আস্সান অর নিল রং ইবা অসাদারন,Chittagong
আকাশে তারাগুলি আমাদেরকে আশা দেয়,আস্সান অর তারাগুন আঁরারে আশা দে,Chittagong
আকাশে মেঘের কারণে বৃষ্টি পড়ে,আসসানে মিয়ালার লাই যর ফরের,Chittagong
মাছগুলি পানির মধ্যে সুন্দর,মাচ্চুন ফানির মাযে সুন্দর,Chittagong
তুমি এখানে থাকলে আমি খুশি,তুঁই এডে তাকিলে আঁই কুশি,Chittagong
আমি সকালে ঘুমিয়ে উঠি,আঁই বেইন্না গুম যাই উডি,Chittagong
আমার লাল রঙের গাড়িটি গতকাল চুরি হয়ে গেছে,আঁর লাল রং অর গারিয়ান গত হালিয়া চুরি অইয়্যে,Chittagong
আমার বাসায়  গতকাল রাতে চুরি হয়েছে,আঁর গর অত গতহালিয়া রাইত অত চুরি অইয়্যে,Chittagong
আমার গাড়ির রঙ হলো লাল,আঁর গারির রং হালা,Chittagong
সহজ ভাষায় কথা বলা উচিত,সহয বাসাত হতা হওয়া উচিত,Chittagong
আমি আপনার সঙ্গে আছি,আঁই অনর ফোয়ারে আচু,Chittagong
আমার আব্বু বিদেশে থাকে,আঁর আব্বু বিদেশ তাকে,Chittagong
আমার ছোটো ভাই দুই মাস পর বিদেশে পড়ালেখা করতে যাবে,আঁর চোড ভাই দুইমাস ফর বিদেশত ফরালেহা গইরতো যাইবো,Chittagong
আমার বড় বোন আমাকে অনেক ভালবাসে,আঁর বরবইন আঁরে বউত বালবাসে,Chittagong
আমার বড় বোনকে আমি অনেক ভালবাসি,আঁর বর বইনকে আই বউত বালবাসি,Chittagong
আপনার বড় বোনের কি বিয়ে হয়ে গেছে ?,অনর বর বইনর কি বিয়া অই গেইয়্যুয় নে?,Chittagong
তোর বড় ভাইয়ের নাম কি ?,তোর বর বাইয়ের নাম কি,Chittagong
তোর বড় ভাইয়ের সাথে আমার বিয়ে হওয়ার  কথা চলতাসে,তোর বর বাইয়ের ফোয়ারে আঁর বিয়ার হতা চলের,Chittagong
বিদেশে ঘুরতে যাওয়া আমার স্বপ্ন,বিদেশ অত গুইরতো যাওয়া আঁর সপ্ন,Chittagong
আমি কখনই তোমাকে ভুলবো না,আঁই হন অত্তে তোঁয়ারে ন বুইল্লম,Chittagong
তুমি আমার জীবনের আলো,তুঁই আঁর যিবনর আলো,Chittagong
সকালে পড়াশোনা করা ভালো উপায়,বেইন্না ফরাশুনা গরা বালা,Chittagong
পরীক্ষার জন্য সকালে পড়াশোনা করা ভালো হয়,ফরিক্কার লাই বেইন্না ফরাশোনা গরা বালো,Chittagong
সকালে পড়াশোনা করে প্রতিদিন শুরু করা ভালো হয়,বেইন্না ফরাশুনা গরি ফত্তিন শুরু গরা গম,Chittagong
সকালে পড়াশোনা করে আমি আরামে মনোযোগ দিতে পারি,বেইন্না ফরাশুনা গরি আঁই আরাম গরি মনোযোগ দিত ফারি,Chittagong
সকালের শুরুতেই পড়াশোনা শুরু করা ভালো,বেইন্না ফ-য-রত ফরাশোনা শুরা গরা বালো,Chittagong
অনেকদিন আগে এক গ্রামে এক টুপি বিক্রেতা ছিলেন,বউদ্দিন আগে এক গেরামঅত এক টুফিওয়ালা আচিল,Chittagong
তিনি একদিন পাশের গ্রামে গিয়ে টুপি বিক্রি করছিলেন,ইবা একদিন পাশর গেরাম অত যাই টুফি বেচের,Chittagong
তিনি রাস্তা দিয়ে তার গ্রামের দিকে ফিরছিলেন,ইবা রাস্তা দি তার গেরাম অর ইক্কা ফিরের,Chittagong
সেই সময় পাশ দিয়ে এক শিয়াল যাচ্ছিল,এত্তে ডাহদ্দি ওজ্ঞা ইয়াল যার,Chittagong
আমাকে সেখানে নিয়ে চলো,আঁরে এডে লই য,Chittagong
এরপর থেকে তারা দুজনই সবজি বাগানে গিয়ে পেট ভরে খাবার খেতো,এরফর অইতে ইতারা দুইজন সব্জি বাগানত যায় এরে ফেট বরি হানা হাইতো,Chittagong
এখন তুমি গান গাইতে পারবে না,এহন তুঁই গান গাইত ন ফারিবা,Chittagong
আমি গান গাইতে চাই,আঁই গান গাইতো চাই,Chittagong
এখন যদি তুমি গান গাও তবে চাষী শুনতে পাবে,এহন যদি তুঁই গান গ তইলে চাষি ফুনিবো,Chittagong
একদিন নদীর ধারে একটি গাছে কাঠ কাটার সময় তার কুড়ালটি নদীর জলের মধ্যে পড়ে যায়,এদ্দিন নদীর দারোত ওজ্ঞা গাচঅত দারগোয়া হাডিবার সময় তার কুরইল্লান নদির ফানির মাযে ফইরগই,Chittagong
আমার নীল আকাশ দেখতে অনেক ভালো লাগে,আঁত্তুন নিল আসসান চাইতো গম লাগে,Chittagong
তোমার কি নীল আকাশ দেখতে ভালো লাগে ?,তোঁয়ার কি নিল আসসান চাইতো গম লাগে নে?,Chittagong
আমার পরীক্ষা দিতে একদমই ভালো  লাগে না,আঁত্তুন ফরিক্কা দিতো এব্বেরেও গম ন লাগে,Chittagong
আপনার কি পরীক্ষা দিতে ভালো  লাগে ?,অনরতুন কি ফরিক্কা দিতে গম লাগে নে,Chittagong
আপনি কেমন আছেন?,অনে কেন আচন,Chittagong
আমি ভালো আছি,আঁই গম আচি,Chittagong
কী করছেন আপনি এখন?,কি গরন দে অনে এহন,Chittagong
আমি একটি বই পড়ছি,আঁই ওজ্ঞা বই ফরির,Chittagong
আপনি কী অন্যান্য বই পড়েছেন?,অনে কি অন্যান্য বই ফরন নে,Chittagong
তুমি কি সরকারি চাকরি করছো?,তুঁই কি সরকারি চঅরি গরর দে নে,Chittagong
আমি একজন সরকারি কর্মকর্তা,আঁই একযন সরকারি কর্মকর্তা,Chittagong
তুমি কি চাকরি করছো?,তুঁই কি চ অরি গরর দে নে,Chittagong
আমি একজন প্রফেশনাল ব্লগার হয়ে কাজ করছি,আঁই একযন ফ্রফেশনাল ব্লগার হিসাবে হায গরির,Chittagong
তুমি কোথায় চাকরি করছো?,তুঁই হডে চ অরি গরর দে,Chittagong
দূরে কোথাও যেখানে কেউ নেই ,দুরে হনোমিক্কা যেডে হনকিয়াই নেই,Chittagong
আমি কেন সবসময় কষ্ট পাই?,আঁই কা এগাযা হস্ট ফাই?,Chittagong
আমার ভালোবাসায় কম কি ছিলো ?,আঁর বালোবাসায় হম কি আচিল,Chittagong
তারা তিন ভাই ছিল কিন্তু তাদের মদ্ধে মিল ছিলো না,ইতারা তিন বাই আচিল কিন্তু তারার মাযে মিল ন আচিল,Chittagong
আপনি আমার সাথে এভাবে কথা বলতে পারেন না,অনে আঁর লই এন গরি হতা হইত ন ফারঅন,Chittagong
আপনি  অনেক ভালো মানুষ ,অনে বউত বালা মানুষ,Chittagong
আমরা ঢাকায় থাকি ,আঁরা ডাহা তাকি,Chittagong
আমি ঢাকার মিরপুরে  থাকি ,আঁই ডাহার মিরফুর তাকি,Chittagong
আমি তার চোথের মায়ায় পড়েছি ,আঁই ইবার চকোর মায়াত ফইরগি,Chittagong
তার হাসি অনেক সুন্দর,ইবার আসি বউত সুন্দর,Chittagong
সে তার পরিবারকে ভালবাসে ,ইবা ইবার ফরিবার অরে বালবাসে,Chittagong
তার জন্য আমি সব কিছু করতে পারি ,এবার লাই আঁই বেজ্ঞিন গরিত ফারি,Chittagong
আমি তাকে ভালবাসি ,আঁই ইবারে বালবাসি,Chittagong
তার চুলগুলি অনেক লম্বা,ইবার চুল্লিন বউত লম্বা,Chittagong
তাকে কাজল দিলে অনেক ভালো লাগে,ইবারে হাযল দিলে বউত বালা লাগে,Chittagong
তুমি কি আমায় ভালোবাসো না? ,তুঁই কি আঁরে বালা ন বাসো?,Chittagong
তুমি বুঝো না কেন ?,তুঁই ন কা বুযো,Chittagong
সে গান গাইতে পছন্দ করে ,ইবা গান গাইতো ফচন্দ গরে,Chittagong
সে যেই মেয়েটিকে ভালবাসে ওই মেয়েটি ঢাকায় থাকে,ইতে যে মাইফোয়া ওয়ারে বালাবাসে মাইফোয়া এবা ডাহা তাকে,Chittagong
আপনি যেই ছেলেকে ভালবাসেন সেই ছেলেটি কি আপনাকে ভালবাসে ?,অনে যে ফোয়ারে বালবাসোন ফোয়াইবা কি অনোরে বালবাসেনে?,Chittagong
সে একটি গাড়ি চুরি করেছে,ইতে এক্কান গারি চুরি গইরগে,Chittagong
আমি তোমার সাথে পৃথিবী ঘুরে আসতে চাই ,আঁই তোয়াঁর ফোয়ারে পিতিবি গুরি আইতো চাই,Chittagong
কিন্তু আমিতো তোমার সাথে যাবো না ,কিন্তু আঁই ত তোঁয়ার ফোয়ারে ন যাইয়্যুম,Chittagong
তোমার কথা শুনে খুব ভালো লাগলো ,তোঁয়ার হতা ফুনি কুব গম লাইজ্ঞে,Chittagong
তোমার ভালো না লাগলে কিছু করার নাই ,তোঁয়াত্তুন গম ন লাগিলে কিচু গরার নাই,Chittagong
ছবি তোলার পর আমাকে কেমন লাগে? ,চবি তোলার ফর আঁরে কেন লাগে,Chittagong
আমি আজকে অনেকদিন পর তার সাথে কথা বলেছি,আঁই আযিয়া বউদ্দিন ফর ইবার লই হতা হইয়্যি,Chittagong
সে দেখতে অনেক সুন্দর ,ইবা দেইক্তে বউত সুন্দর,Chittagong
কিন্তু সৌন্দর্যই সবকিছু না,কিন্তু সুন্দইর্যই বেজ্ঞিন নই,Chittagong
তার চোখ হরিণের মতো,ইবার চোক অরিনর নান,Chittagong
একটা মেয়ে আর একটা ছেলে একসাথে খেলছে,ওজ্ঞা মাইয়্যা আর ওজ্ঞা ফোয়া এক্কোফোয়ারে কেলা হার,Chittagong
কালো কুকুরটা ঘাসের মধ্যে দিয়ে ছুটছে,হালা কুত্তাইবা কেরঅর মাযে দুরের,Chittagong
একটা কালো কুকুর ঘাসের মধ্যে দৌড়াচ্ছে,ওজ্ঞা হালা কুত্তা কের অর মাযে দুরের,Chittagong
একটি ছোট কালো কুকুর ঘাসে মধ্যে শুয়ে আছে,ওজ্ঞা গুরা কালা কুত্তা কের অর মযে লুডি তাইক্কে,Chittagong
একদল মহিলা রাস্তায় হাঁটছে,একগাট্টি বেডিওক্কল রাস্তাত আডের,Chittagong
দরজার কাছে দুইজন বসে গিটার বাজাচ্ছে,দর্জার হাচে বই দুইজন গিটার বাজার,Chittagong
ফুটপাতে একসঙ্গে হাঁটছেন তিন মহিলা,ফুটফাতোত এক্কোফোয়ারে তিনযন বেডি আডের,Chittagong
আম্মুর জন্য বেশি খারাপ লাগছে,আম্মুর লাই বেশি ফেট ফূরের,Chittagong
আমাদের পরিবারে  আম্মুর অবদানই বেশি বলে আমি মনে করি,আঁরার ফরিবারোত আম্মুর আবদানই বেশি বলিবাঁই মনো গরি,Chittagong
তোমাদের জন্য কিছু করতে তো পারলামই না উল্টো পরিবারকে  শেষ করলাম,তোঁয়ারার লাই তো কিচু গরিত্ ন পারি উল্ডা ফরিবারগানেরে শেষ গইরগি,Chittagong
"সবসময় ভয়ে ভয়ে থাকতাম, গলা দিয়ে খাবার নামতো না","এগাযা ডরে ডরে তাকিতাম, গলাদি হানা ন নামিতো",Chittagong
শেষ করলাম সবকিছু,শেষ গরি দিইয়্যি বেজ্ঞিন,Chittagong
"যদিও ক্ষমার যোগ্য না আমি, পারলে ক্ষমা করে দিয়েন",যদিও আঁই কমার যোগ্য নই ফাইরলে কমা গরি দি অন,Chittagong
আপনাদের অযোগ্য সন্তান,অঁনোরার অযোগ্য ফোয়া,Chittagong
আল্লাহ রহমতের বৃষ্টি দাও,আল্লা রঅমোতর‍ যর দ,Chittagong
বৃষ্টির জন্য ঢাকায় কোথাও নামাজ পড়া হবে কি ?,যরর লাই ডাহা হনোমিক্কা নোয়ায ফরা অইবো নে,Chittagong
পানির জন্য হাহাকার আর ভালো লাগছে না,ফানির কাই হাহাকার আর বালা ন লার,Chittagong
উত্তরাতে আমাদের ভবনে  কোনোভাবেই পানি পাচ্ছি না আমরা,উত্তরাত আঁরার ববনত হনোবাবেই ফানি ন ফাইর,Chittagong
শুধু এক গাড়ি পানি হলেও ২টা দিন চলা যেতো,শুদু এগ্গারি ফানি অইলেও দুওয়া দিন চলা যাইত,Chittagong
কোনোভাবেই ওয়াসা পানি দিচ্ছে না,হনোবাবেই ওয়াসা ফানি ন দের,Chittagong
কি করতে পারি বলুন এখন?,কি গরিত ফারি হন এহন,Chittagong
বিদ্যুৎ ছাড়া না হয় থাকা যায় কিন্তু পানি ছাড়া কিভাবে থাকে মানুষ,কারোম চারা না অয় তাহা যায় কিন্তু ফানি চারা কেনে তাকে মানুষ,Chittagong
আজকে জুম্মার দিন ,আযিয়া জুমার দিন,Chittagong
আমি শুক্রবার অনেক সকালে উঠি ,আঁই শুক্কুরবার চঅরে চঅরে ঊডি,Chittagong
সে অনেক বেলা করে ঘুমায় ,ইতে বউত বেলা গরি গুমযাই,Chittagong
সে আমাকে একটি উপহার দিয়েছে ,ইতে আঁরে ওজ্ঞা উফার দিয়্যে,Chittagong
আজকে আমার জন্মদিন ,আযিয়া আঁর জন্মদিন,Chittagong
আমার বয়স বেশি না,আঁর বয়স বেশি ন,Chittagong
তার চেয়ে আমি দেখতে সুন্দর ,ইবারতুন বেরা আঁই দেইকতে সুন্দর,Chittagong
এইবার কুরবানিতে লাল গরু কিনবো ,এইবার কুরবানিত লাল গরু কিন্নোম,Chittagong
সবকিছু একসাথে করা সম্ভব না ,বেজ্ঞিন এক্কোফোয়ারে গরা সম্বব নই,Chittagong
তুমি বিয়ে করছো না কেন?,তুঁই বিয়া কা ন গরর,Chittagong
ভালো মেয়ে পাচ্ছি না ,বালা মাইফোয়া ন ফাইর,Chittagong
ঘড়িতে কয়টা বাজে? ,গরিত হটা বাযের,Chittagong
আজকে দুপুরে আমাদের দাওয়াত আছে ,আযিয়া দুইরগা আঁরার দঅত আচে,Chittagong
সবাই কেমন আছো?,বেজ্ঞুন কেন আচো,Chittagong
আজকে কত তারিখ?,আযিয়া হত তারিক,Chittagong
মন ভালো করতে তোমরা কি কর?,মন বালা গরি বিল্লাই তোঁয়ারা কি গরো,Chittagong
আমি মাঝেমধ্যে গান শুনি,আঁই মাযেমদ্যে গান ফুনি,Chittagong
আজকাল পড়াশোনার চাপ অনেক বেশি,আইযহাল ফরাশোনার চাপ বউত বেশি,Chittagong
তোমরা কি গল্পের বই পড়তে পছন্দ কর?,তোঁয়ারা কি গল্ফর বই ফইরতো পচন্দ গরো নে?,Chittagong
তোমাদের প্রিয় লেখক কে ?,তোঁয়ারার ফ্রিয় লেকক হন,Chittagong
আমার প্রিয় লেখক হুমায়ুন আহমেদ,আঁর ফ্রিয় লেকক হুমায়ুন আহমেদ,Chittagong
ফুটবলে তোমাদের প্রিয় দল কোনটি?,ফুটবলত তোঁয়ারার প্রিয় দল হন্নান?,Chittagong
ব্রাজিল ফুটবলের সেরা দল,ব্রাযিল ফূটবুলঅর সেরা দল,Chittagong
